{
  "checksum": "b63e20ac33713e6cc58eeb36ce087500611ee551cf175ebc7c90463eb9109c85",
  "databaseId": "00000000000000000000000000000001",
  "dialect": "voxel",
  "formatVersion": 1,
  "id": "00000000000000000000000000000023",
  "parentId": null,
  "phases": [
    {
      "id": "0",
      "mode": "transactional",
      "platforms": [
        "native",
        "browser"
      ],
      "recovery": null,
      "scopeId": "00000000000000000000000000000002",
      "statements": [
        {
          "endByte": 189,
          "startByte": 0
        },
        {
          "endByte": 527,
          "startByte": 190
        },
        {
          "endByte": 628,
          "startByte": 528
        },
        {
          "endByte": 969,
          "startByte": 629
        },
        {
          "endByte": 1116,
          "startByte": 970
        },
        {
          "endByte": 1384,
          "startByte": 1117
        },
        {
          "endByte": 1482,
          "startByte": 1385
        }
      ]
    }
  ]
}
